{
  "$schema": "http://json-schema.org/draft-07/schema#",
  "title": "Synapse scaffold preset",
  "type": "object",
  "additionalProperties": false,
  "required": ["schema_version", "id", "label", "description", "tags", "files"],
  "properties": {
    "schema_version": {"type": "integer", "const": 1},
    "id": {"type": "string", "pattern": "^[a-z][a-z0-9_.-]*$", "maxLength": 160},
    "label": {"type": "string", "minLength": 1, "maxLength": 200},
    "description": {"type": "string", "minLength": 1, "maxLength": 2000},
    "tags": {"type": "array", "minItems": 1, "uniqueItems": true, "items": {"type": "string", "maxLength": 80}},
    "files": {
      "type": "array",
      "minItems": 1,
      "items": {
        "type": "object",
        "additionalProperties": false,
        "required": ["path", "title", "purpose", "required", "initial_status"],
        "properties": {
          "path": {"type": "string", "minLength": 1, "maxLength": 240},
          "title": {"type": "string", "minLength": 1, "maxLength": 2000},
          "purpose": {"type": "string", "minLength": 1, "maxLength": 2000},
          "required": {"type": "boolean"},
          "initial_status": {"enum": ["EMPTY", "GUIDE", "PROPOSED"]}
        }
      }
    }
  }
}
