{
  "schema_version": 1,
  "id": "research",
  "label": "연구 / 지식",
  "description": "자료의 출처와 주장, 검증 방법을 분리해 관리합니다.",
  "tags": ["근거", "분석"],
  "files": [
    {"path": "synapse.project.yaml", "title": "Project manifest", "purpose": "프로젝트 이름·프리셋·초안 버전을 기록합니다.", "required": true, "initial_status": "GUIDE"},
    {"path": "README.md", "title": "사용 안내", "purpose": "처음 합의한 목표와 다음 작업 순서를 짧게 적습니다.", "required": true, "initial_status": "GUIDE"},
    {"path": "00_intake/idea.md", "title": "아이디어 원문", "purpose": "사용자가 처음 적은 아이디어를 원문 그대로 보존합니다.", "required": true, "initial_status": "EMPTY"},
    {"path": "01_context/goals.md", "title": "목표", "purpose": "무엇을 만들고 어떤 결과를 원하는지 적습니다.", "required": true, "initial_status": "EMPTY"},
    {"path": "01_context/constraints.md", "title": "제약과 경계", "purpose": "하지 않을 일, 환경, 비용, 안전 조건을 적습니다.", "required": true, "initial_status": "EMPTY"},
    {"path": "02_model/entities.md", "title": "핵심 대상", "purpose": "사람·파일·개념·기능 등 핵심 대상을 정의합니다.", "required": true, "initial_status": "EMPTY"},
    {"path": "02_model/relations.md", "title": "관계", "purpose": "대상 사이의 연결과 의존성을 적습니다.", "required": true, "initial_status": "EMPTY"},
    {"path": "03_rules/invariants.md", "title": "정합성 규칙", "purpose": "항상 지켜야 하는 규칙과 금지사항을 적습니다.", "required": true, "initial_status": "EMPTY"},
    {"path": "04_work/next_steps.md", "title": "다음 작업", "purpose": "작게 나눌 다음 작업과 완료 조건을 적습니다.", "required": true, "initial_status": "EMPTY"},
    {"path": "99_review/open_questions.md", "title": "미해결 질문", "purpose": "아직 결정하지 않은 점을 숨기지 않고 남깁니다.", "required": true, "initial_status": "EMPTY"},
    {"path": "02_model/sources.md", "title": "자료와 출처", "purpose": "근거가 되는 자료와 provenance를 기록합니다.", "required": true, "initial_status": "EMPTY"},
    {"path": "03_rules/method.md", "title": "방법", "purpose": "분석 방법과 판단 기준을 적습니다.", "required": true, "initial_status": "EMPTY"},
    {"path": "04_work/experiments.md", "title": "실험 / 조사", "purpose": "반복 가능한 조사와 결과를 적습니다.", "required": true, "initial_status": "EMPTY"}
  ]
}
